[
  {
    "id": "def-orchestrator",
    "version": "4.1.2",
    "display_name": "编排器",
    "execution_kind": "primary",
    "labels": [
      "orchestrator"
    ],
    "identity_prompt_ref": "seed://def-orchestrator",
    "default_recipe_id": "open",
    "tool_surface_ref": "tools://def-orchestrator",
    "model_ref": null,
    "max_iterations": 12,
    "hitl_profile_ref": null,
    "allowed_callers": [],
    "triggers": [],
    "enabled": true
  },
  {
    "id": "def-market-data",
    "version": "2.6.0",
    "display_name": "行情数据",
    "execution_kind": "subagent",
    "labels": [
      "market_data",
      "report"
    ],
    "identity_prompt_ref": "seed://def-market-data",
    "default_recipe_id": "open",
    "tool_surface_ref": "tools://def-market-data",
    "model_ref": null,
    "max_iterations": 5,
    "hitl_profile_ref": null,
    "allowed_callers": [],
    "triggers": [],
    "enabled": true
  },
  {
    "id": "def-news-event",
    "version": "3.5.3",
    "display_name": "新闻事件",
    "execution_kind": "subagent",
    "labels": [
      "news_event",
      "events",
      "report"
    ],
    "identity_prompt_ref": "seed://def-news-event",
    "default_recipe_id": "news",
    "tool_surface_ref": "tools://def-news-event",
    "model_ref": null,
    "max_iterations": 4,
    "hitl_profile_ref": null,
    "allowed_callers": [],
    "triggers": [],
    "enabled": true
  },
  {
    "id": "def-analyst-fundamental",
    "version": "3.6.1",
    "display_name": "基本面研究员",
    "execution_kind": "subagent",
    "labels": [
      "analyst_fundamental",
      "signal",
      "report"
    ],
    "identity_prompt_ref": "seed://def-analyst-fundamental",
    "default_recipe_id": "open",
    "tool_surface_ref": "tools://def-analyst-fundamental",
    "model_ref": null,
    "max_iterations": 6,
    "hitl_profile_ref": null,
    "allowed_callers": [],
    "triggers": [],
    "enabled": true
  },
  {
    "id": "def-analyst-technical",
    "version": "3.6.0",
    "display_name": "量化策略师",
    "execution_kind": "subagent",
    "labels": [
      "analyst_technical",
      "signal",
      "report"
    ],
    "identity_prompt_ref": "seed://def-analyst-technical",
    "default_recipe_id": "open",
    "tool_surface_ref": "tools://def-analyst-technical",
    "model_ref": null,
    "max_iterations": 6,
    "hitl_profile_ref": null,
    "allowed_callers": [],
    "triggers": [],
    "enabled": true
  },
  {
    "id": "def-analyst-sentiment",
    "version": "3.6.0",
    "display_name": "舆情分析师",
    "execution_kind": "subagent",
    "labels": [
      "analyst_sentiment",
      "signal",
      "report"
    ],
    "identity_prompt_ref": "seed://def-analyst-sentiment",
    "default_recipe_id": "open",
    "tool_surface_ref": "tools://def-analyst-sentiment",
    "model_ref": null,
    "max_iterations": 6,
    "hitl_profile_ref": null,
    "allowed_callers": [],
    "triggers": [],
    "enabled": true
  },
  {
    "id": "def-analyst-macro",
    "version": "3.6.0",
    "display_name": "宏观策略师",
    "execution_kind": "subagent",
    "labels": [
      "analyst_macro",
      "signal",
      "report"
    ],
    "identity_prompt_ref": "seed://def-analyst-macro",
    "default_recipe_id": "open",
    "tool_surface_ref": "tools://def-analyst-macro",
    "model_ref": null,
    "max_iterations": 6,
    "hitl_profile_ref": null,
    "allowed_callers": [],
    "triggers": [],
    "enabled": true
  },
  {
    "id": "def-research",
    "version": "4.5.0",
    "display_name": "策略研究",
    "execution_kind": "subagent",
    "labels": [
      "research",
      "report",
      "factor_candidates",
      "strategy_dsl"
    ],
    "identity_prompt_ref": "seed://def-research",
    "default_recipe_id": "factor",
    "tool_surface_ref": "tools://def-research",
    "model_ref": null,
    "max_iterations": 10,
    "hitl_profile_ref": null,
    "allowed_callers": [],
    "triggers": [],
    "enabled": true
  },
  {
    "id": "def-backtest",
    "version": "4.3.0",
    "display_name": "回测",
    "execution_kind": "subagent",
    "labels": [
      "backtest",
      "backtest_results",
      "report"
    ],
    "identity_prompt_ref": "seed://def-backtest",
    "default_recipe_id": "factor",
    "tool_surface_ref": "tools://def-backtest",
    "model_ref": null,
    "max_iterations": 8,
    "hitl_profile_ref": null,
    "allowed_callers": [],
    "triggers": [],
    "enabled": true
  },
  {
    "id": "def-risk",
    "version": "4.3.0",
    "display_name": "风控",
    "execution_kind": "subagent",
    "labels": [
      "risk",
      "risk_assessment",
      "report"
    ],
    "identity_prompt_ref": "seed://def-risk",
    "default_recipe_id": "open",
    "tool_surface_ref": "tools://def-risk",
    "model_ref": null,
    "max_iterations": 6,
    "hitl_profile_ref": null,
    "allowed_callers": [],
    "triggers": [],
    "enabled": true
  },
  {
    "id": "def-walk-forward-validator",
    "version": "1.2.0",
    "display_name": "Walk-Forward 验证师",
    "execution_kind": "subagent",
    "labels": [
      "backtest_engineer",
      "backtest_results",
      "report"
    ],
    "identity_prompt_ref": "seed://def-walk-forward-validator",
    "default_recipe_id": "factor",
    "tool_surface_ref": "tools://def-walk-forward-validator",
    "model_ref": null,
    "max_iterations": 10,
    "hitl_profile_ref": null,
    "allowed_callers": [],
    "triggers": [],
    "enabled": true
  }
]
